figure,working_title,main_claim,status,current_files,next_action
Fig. 1,Workflow from proxy packing to fracture-resolved compression,Locked-template insertion separates bed formation from pebble fracture,available,figures/main/fig1_workflow.svg,Polish schematic if journal art style requires more realistic bed rendering
Fig. 2,Single-pebble calibration of the bonded template,SP-002-CAL1 provides the current load/morphology calibration candidate,available,figures/sp002/single_pebble_calibration_evidence.svg,Polish labels and add fragment graph inset if available
Fig. 3,Locked internal bonds in 500- and 1000-pebble random beds,Templates enter random beds intact with zero internal bond loss,partial,"tables/pb006_seed_manifest.csv; tables/pb006_1000_proxy_packing_summary.csv",Create compact figure/table panel for subparticles, intact bonds and bed height
Fig. 4,Three-seed 500-pebble breakage event statistics,Onset is reproducible but later event growth is seed-dependent,available,figures/pb006/pb006_breakage_event_database.svg,Use as central event-statistics figure after label polishing
Fig. 5,Upper-bed packing explains stronger damage cascade,Seed03 damage amplification follows denser upper packing and broader overlap-derived force paths,available,"figures/pb006/pb006_three_seed_packing_breakage.svg; figures/pb006/pb006_seed02_seed03_overlap_force_proxy.svg",Consider merging packing descriptors and overlap proxy into one two-row figure
Fig. 6,1000-pebble onset and targeted-window event localization,Scale-up preserves top-layer onset and localizes six 1000-pebble events,available,"figures/pb006/pb006_500_vs_1000_short_comparison.svg; figures/pb006/pb006_1000_targeted_window_event_sequence.svg",Update if 0.15 mm restartable run completes
Fig. 7,1000-pebble post-onset propagation to 0.15 mm,The 1000-pebble seed01 run resolves onset-plateau-late-burst fracture sequencing and top-layer spread from pebble 1000 to pebbles 961 and 980,available,figures/pb006/pb006_1000_0p15_three_stage_sequence.svg,Polish labels and combine with contact-force evidence if native force chains are later extracted
Fig. 8,1000-pebble event-sequence variability,Completed seed01 orient02 and seed02 cases preserve a top-layer trigger but differ strongly in post-onset propagation,available,"figures/pb006/pb006_1000_orientation_sensitivity.svg; tables/pb006_1000_orientation_sensitivity_metrics.csv",Use as main variability figure with conservative wording; do not claim converged probability statistics
