claim_id,draft_claim,current_status,evidence_files,generation_or_check_script,current_numeric_anchor,boundary_for_writing,next_action
C1,The 500-subparticle weak-plane bonded template reproduces the intended 1 mm crush-load scale and split-type fragment mode within the tested sensitivity range.,manuscript_ready,tables/single_pebble_model_calibration_matrix.csv; tables/sp002_strength_multiplier_validation.csv; tables/sp002_weibull_ensemble_completed_summary.csv; figures/apt_redesign/fig2_single_pebble_template_validation.*,scripts/build_apt_redesigned_data_figures.py,selected template peak top force 18.64 N; two dominant fragments in the selected weak-plane family,"Describe as a calibrated template candidate and sensitivity-bounded representation, not a final Li4SiO4 material law.",Keep current wording conservative and link it to the completed strength-matrix section.
C2,"The locked-template transfer creates a pre-fracture bed with zero internal-bond loss, measurable force transmission and a connected native force graph.",manuscript_ready,tables/pb007_*_acceptance_summary.csv; tables/pb007_*_native_summary.csv; figures/apt_redesign/fig3_entry_state_validation.*,scripts/plot_pb007_pre_damage_force_transmission_validation.py; scripts/build_apt_redesigned_data_figures.py,"493,500 initial internal bonds; selected 5 micrometre entry route; final force-balance residual 4.799% in the selected protocol.",Use as entry-state validation for selected 100-parent-particle windows only.,Reuse in revised Methods/Results; do not add stronger quasi-static claims.
C3,Corrected finite-window beds reveal localized fracture-event sequences and zero-loss controls embedded in spanning inter-particle force networks.,manuscript_ready,tables/pb007_macro_topology_event_metrics.csv; tables/pb007_event_aligned_topology.csv; tables/pb007_mechanism_indices.csv; figures/apt_redesign/fig4_pilot_fracture_event_sequence.*; figures/apt_redesign/fig5_mechanism_state_space.*,scripts/summarize_pb007_mechanism_metrics.py; scripts/summarize_pb007_event_aligned_topology.py; scripts/build_apt_redesigned_data_figures.py,"4 cracking cases, 5 intact/zero-loss cases and 2 200-parent-particle intact comparison in the macro-topology table.","Frame as finite-window event-sequence and intact-comparison evidence, not converged fracture probability.",Retain as the central result and combine it with the completed material-matrix response.
C4,Bond-strength reduction shifts the fracture-onset response differently in early-cracking and synchronous-cracking random geometries.,manuscript_ready,tables/pb007_material_parameter_matrix_20260704.csv; tables/pb007_material_parameter_response.csv; tables/pb007_material_strength_matrix_summary.csv; data/figure_source/pb007_material_strength_response.csv; figures/pb007/pb007_material_strength_response.*,scripts/report_pb007_material_parameter_progress.py; scripts/summarize_pb007_material_parameter_response.py; scripts/build_pb007_material_strength_response_progress.py,All six strength-matrix rows are completed and postprocessed. Seed04 first-event displacement remains 19 micrometres from 1.0x to 0.5x and endpoint broken bonds rise to 15 at 0.25x; seed06 shifts from 39 micrometres at 1.0x to 29 micrometres at 0.75x and 19 micrometres at 0.5x/0.25x.,Use as finite-window material-strength evidence across two cracking geometries; do not present as a universal strength law.,Integrate into the Results strength-matrix section and rebuild the final figure/caption.
C5,Random packing topology and material strength jointly control whether local microcracking appears before the 60 micrometre endpoint.,manuscript_ready,tables/pb007_macro_topology_event_metrics.csv; tables/pb007_material_parameter_response.csv; tables/pb007_mechanism_variable_separation.csv; data/figure_source/pb007_mechanism_variable_separation.csv,scripts/summarize_pb007_material_parameter_response.py; scripts/summarize_pb007_mechanism_variable_separation.py,"Across 11 completed material-response endpoints, the minimum cracking final inter-particle force sum is 2.28 times the maximum zero-loss value; strength multipliers overlap between endpoint classes.","State as finite-window topology and strength interaction evidence, not converged stochastic failure probability.",Write the synthesis around geometry-specific onset shifts and endpoint bond-loss changes.
C6,The repaired paper provides expanded random-geometry and scale-check evidence rather than isolated case reporting.,partial,tables/pb007_rescue_case_status_summary_20260704.csv; tables/pb007_macro_topology_event_metrics.csv,scripts/summarize_pb007_rescue_status.py; scripts/summarize_pb007_mechanism_metrics.py,"Current macro table has 9 endpoint cases, including 4 cracking cases and 2 completed 200-parent-particle intact scale/strength endpoints.",Do not call this a converged stochastic ensemble; describe as expanded finite-window evidence with two larger-bed intact endpoint comparisons.,Add another larger-bed cracking or near-onset case only if the next target journal demands scale robustness beyond the present bounded claim.
C7,"The event-sequence variables can support future transport, permeability or thermal-contact degradation models.",future_work_only,none for coupled transport in the current project,not applicable,No coupled thermal-flow or permeability calculation has been completed for this manuscript.,Mention only as future coupling or implication; do not claim transport prediction.,Optional later: design reduced permeability/thermal-contact calculation after mechanical evidence is complete.
C8,The repaired workflow is reproducible and cloud-safe after moving large raw archives to local/NAS storage.,support_ready,docs/local_vs_nas_storage_policy.md; docs/nas_raw_dump_archive_20260704_164309.md; docs/nas_offload_large_raw_outputs_before_20260704_20260704.md; docs/nas_offload_manifests/*; scripts/offload_large_dem_archives_to_nas.py,scripts/offload_large_dem_archives_to_nas.py; shell SHA256 checks recorded in docs,Large old raw outputs moved to /Volumes/BulkArchive/DEM_ARCHIVE/颗粒破碎统计研究 and /Volumes/BulkArchive/颗粒破碎统计研究_backup; active PB-007 results remain local.,"Use for internal reproducibility/storage management, not as a scientific result.",Keep submission package compact; offload old raw dumps after postprocessing when safe.
